30738032;Desbridamento do labrum ou ligamento redondo com ou sem condroplastia - procedimento videoartroscópico de coxofemoral;2009-02-13;;2010-10-15
30738040;Tratamento do impacto femoro-acetabular - procedimento videoartroscópico de coxofemoral;2009-02-13;;2010-10-15
30738059;Condroplastia com sutura labral - procedimento videoartroscópico de coxofemoral;2009-02-13;;2010-10-15
30801010;Colocação de órtese traqueal, traqueobrônquica ou brônquica, por via endoscópica (tubo de silicone ou metálico);2009-02-13;;2010-10-15
30801028;Colocação de prótese traqueal ou traqueobrônquica (qualquer via);2009-02-13;;2010-10-15
30801036;Fechamento de fístula tráqueo-cutânea;2009-02-13;;2010-10-15
30801044;Punção traqueal;2009-02-13;;2010-10-15
30801052;Ressecção carinal (traqueobrônquica);2009-02-13;;2010-10-15
30801060;Ressecção de tumor traqueal;2009-02-13;;2010-10-15
30801079;Traqueoplastia (qualquer via);2009-02-13;;2010-10-15
30801087;Traqueorrafia (qualquer via);2009-02-13;;2010-10-15
30801095;Traqueostomia;2009-02-13;2017-07-09;2010-10-15
30801109;Traqueostomia com colocação de órtese traqueal ou traqueobrônquica por via cervical;2009-02-13;;2010-10-15
30801117;Traqueostomia mediastinal;2009-02-13;;2010-10-15
30801133;Plastia de traqueostoma;2009-02-13;;2010-10-15
30801141;Traqueotomia ou fechamento cirúrgico;2009-02-13;;2010-10-15
30801150;Troca de prótese tráqueo-esofágica;2009-02-13;;2010-10-15
30801168;Ressecção de tumor traqueal por videotoracoscopia;2009-02-13;;2010-10-15
30801176;Traqueorrafia por videotoracoscopia;2009-02-13;;2010-10-15
30801184;Traqueostomia com retirada de corpo estranho;2009-02-13;;2010-10-15
30802016;Broncoplastia e/ou arterioplastia;2009-02-13;;2010-10-15
30802024;Broncotomia e/ou broncorrafia;2009-02-13;;2010-10-15
30802032;Colocação de molde brônquico por toracotomia;2009-02-13;;2010-10-15
30802040;Broncoplastia e/ou arterioplastia por videotoracoscopia;2009-02-13;;2010-10-15
30802059;Broncotomia e/ou broncorrafia por videotoracoscopia;2009-02-13;;2010-10-15
30803012;Bulectomia unilateral;2009-02-13;;2010-10-15
30803020;Cirurgia redutora do volume pulmonar unilateral (qualquer técnica);2009-02-13;;2010-10-15
30803039;Cisto pulmonar congênito - tratamento cirúrgico;2009-02-13;;2010-10-15
30803047;Correção de fístula bronco-pleural (qualquer técnica);2009-02-13;;2010-10-15
30803055;Drenagem tubular aberta de cavidade pulmonar;2009-02-13;;2010-10-15
30803063;Embolectomia pulmonar;2009-02-13;;2010-10-15
30803071;Lobectomia por malformação pulmonar;2009-02-13;;2010-10-15
30803080;Lobectomia pulmonar;2009-02-13;;2010-10-15
30803098;Metastasectomia pulmonar unilateral (qualquer técnica);2009-02-13;;2010-10-15
30803101;Pneumonectomia;2009-02-13;;2010-10-15
30803110;Pneumonectomia de totalização;2009-02-13;;2010-10-15
30803128;Pneumorrafia;2009-02-13;;2010-10-15
30803136;Pneumostomia (cavernostomia) com costectomia e estoma cutâneo-cavitário;2009-02-13;;2010-10-15
30803144;Posicionamento de agulhas radiativas por toracotomia (braquiterapia);2009-02-13;;2010-10-15
30803152;Segmentectomia (qualquer técnica);2009-02-13;;2010-10-15
30803160;Tromboendarterectomia pulmonar;2009-02-13;;2010-10-15
30803179;Bulectomia unilateral por videotoracoscopia;2009-02-13;;2010-10-15
30803187;Cirurgia redutora do volume pulmonar unilateral  por videotoracoscopia;2009-02-13;;2010-10-15
30803195;Correção de fístula bronco-pleural por videotoracoscopia;2009-02-13;;2010-10-15
30803209;Drenagem tubular aberta de cavidade pulmonar por videotoracoscopia;2009-02-13;;2010-10-15
30803217;Lobectomia pulmonar por videotoracoscopia;2009-02-13;;2010-10-15
30803225;Metastasectomia pulmonar unilateral por videotoracoscopia;2009-02-13;;2010-10-15
30803233;Segmentectomia por videotoracoscopia;2009-02-13;;2010-10-15
30803241;Biópsia transcutânea de pulmão por agulha;2009-02-13;;2010-10-15
30804019;Biópsia percutânea de pleura por agulha;2009-02-13;;2010-10-15
30804027;Descorticação pulmonar;2009-02-13;;2010-10-15
30804035;Pleurectomia;2009-02-13;;2010-10-15
30804043;Pleurodese (qualquer técnica);2009-02-13;;2010-10-15
30804051;Pleuroscopia;2009-02-13;;2010-10-15
30804060;Pleurostomia (aberta);2009-02-13;;2010-10-15
30804086;Punção pleural;2009-02-13;;2010-10-15
30804094;Repleção de cavidade pleural com solução de antibiótico para tratamento de empiema;2009-02-13;;2010-10-15
30804108;Ressecção de tumor da pleura localizado;2009-02-13;;2010-10-15
30804116;Retirada de dreno tubular torácico (colocado em outro serviço);2009-02-13;;2010-10-15
30804124;Tenda pleural;2009-02-13;;2010-10-15
30804132;Toracostomia com drenagem pleural fechada;2009-02-13;;2010-10-15
30804140;Tratamento operatório da hemorragia intrapleural;2009-02-13;;2010-10-15
30804159;Descorticação pulmonar por videotoracoscopia;2009-02-13;;2010-10-15
30804167;Pleurectomia por videotoracoscopia;2009-02-13;;2010-10-15
30804175;Pleurodese por video;2009-02-13;;2010-10-15
30804183;Pleuroscopia por vídeo;2009-02-13;;2010-10-15
30804191;Ressecção de tumor da pleura localizado por vídeo;2009-02-13;;2010-10-15
30804205;Tenda pleural por vídeo;2009-02-13;;2010-10-15
30804213;Tratamento operatório da hemorragia intrapleural por  vídeo;2009-02-13;;2010-10-15
30805015;Ressecção de bócio intratorácico;2009-02-13;;2010-10-15
30805023;Biópsia de linfonodos pré-escalênicos ou do confluente venoso;2009-02-13;;2010-10-15
30805031;Biópsia de tumor do mediastino (qualquer via);2009-02-13;;2010-10-15
30805040;Cisto ou duplicação brônquica ou esôfagica - tratamento cirúrgico;2009-02-13;;2010-10-15
30805074;Ligadura de artérias brônquicas por toracotomia para controle de hemoptise;2009-02-13;;2010-10-15
30805082;Ligadura de ducto-torácico (qualquer via);2009-02-13;;2010-10-15
30805090;Linfadenectomia mediastinal;2009-02-13;;2010-10-15
30805104;Mediastinoscopia, via cervical;2009-02-13;;2010-10-15
30805112;Mediastinotomia (via paraesternal, transesternal, cervical);2009-02-13;;2010-10-15
30805120;Mediastinotomia extrapleural por via posterior;2009-02-13;;2010-10-15
30805139;Pericardiotomia com abertura pleuro-pericárdica (qualquer técnica);2009-02-13;;2010-10-15
30805147;Ressecção de tumor de mediastino;2009-02-13;;2010-10-15
30805155;Timectomia (qualquer via);2009-02-13;;2010-10-15
30805163;Tratamento da mediastinite (qualquer via);2009-02-13;;2010-10-15
30805171;Vagotomia troncular terapêutica por toracotomia;2009-02-13;;2010-10-15
30805180;Biópsia de tumor do mediastino por vídeo;2009-02-13;;2010-10-15
30805198;Cisto ou duplicação brônquica ou esofágica – tratamento cirúrgico por vídeo;2009-02-13;;2010-10-15
30805201;Ligadura de artérias brônquicas para controle de hemoptise por vídeo;2009-02-13;;2010-10-15
30805210;Ligadura de ducto-torácico por vídeo;2009-02-13;;2010-10-15
30805228;Linfadenectomia mediastinal por vídeo;2009-02-13;;2010-10-15
30805236;Mediastinoscopia, via cervical por vídeo;2009-02-13;;2010-10-15
30805244;Mediastinotomia extrapleural por via posterior por vídeo;2009-02-13;;2010-10-15
30805252;Pericardiotomia com abertura pleuro-pericárdica por vídeo;2009-02-13;;2010-10-15
30805260;Ressecção de tumor de mediastino por vídeo;2009-02-13;;2010-10-15
30805279;Timectomia por vídeo;2009-02-13;;2010-10-15
30805287;Tratamento da mediastinite por vídeo;2009-02-13;;2010-10-15
30805295;Retirada de corpo estranho do mediastino;2009-02-13;;2010-10-15
30806011;Abscesso subfrênico - tratamento cirúrgico;2009-02-13;;2010-10-15
30806020;Eventração diafragmática - tratamento cirúrgico;2009-02-13;;2010-10-15
30806038;Hérnia diafragmática - tratamento cirúrgico (qualquer técnica);2009-02-13;;2010-10-15
30806046;Implante de marca-passo diafragmático definitivo;2009-02-13;;2010-10-15
30806054;Hérnia diafragmática – tratamento cirúrgico por vídeo;2009-02-13;;2010-10-15
30806062;Hérnia diafragmática congênita - tratamento cirúrgico (qualquer via);2021-08-01;;2021-10-31
30806070;Hérnia diafragmática congênita - tratamento cirúrgico por vídeo;2021-08-01;;2021-10-31
30901014;Ampliação (anel valvar, grandes vasos, átrio, ventrículo);2009-02-13;;2010-10-15
30901022;Canal arterial persistente - correção cirúrgica;2009-02-13;;2010-10-15
30901030;Coarctação da aorta - correção cirúrgica;2009-02-13;;2010-10-15
30901049;Confecção de bandagem da artéria pulmonar;2009-02-13;;2010-10-15
30901057;Correção cirúrgica da comunicação interatrial;2009-02-13;;2010-10-15
30901065;Correção cirúrgica da comunicação interventricular;2009-02-13;;2010-10-15
30901073;Correção de cardiopatia congênita + cirurgia valvar;2009-02-13;;2010-10-15
30901081;Correção de cardiopatia congênita + revascularização do miocárdio;2009-02-13;;2010-10-15
30901090;Redirecionamento do fluxo sanguíneo (com anastomose direta, retalho, tubo) - em defeitos cardíacos congenitos;2009-02-13;;2010-10-15
30901103;Ressecção (infundíbulo, septo, membranas, bandas) - em defeitos cardíacos congenitos;2009-02-13;;2010-10-15
30901111;Transposições (vasos, câmaras) - em defeitos cardíacos congenitos;2009-02-13;;2010-10-15
30902010;Ampliação do anel valvar;2009-02-13;;2010-10-15
30902029;Cirurgia multivalvar;2009-02-13;;2010-10-15
30902037;Comissurotomia valvar;2009-02-13;;2010-10-15
30902045;Plastia valvar;2009-02-13;;2010-10-15
30902053;Troca valvar;2009-02-13;;2010-10-15
30903017;Aneurismectomia de VE;2009-02-13;;2010-10-15
30903025;Revascularização do miocárdio;2009-02-13;;2010-10-15
30903033;Revascularização do miocárdio + cirurgia valvar;2009-02-13;;2010-10-15
30903041;Ventriculectomia parcial - em coronariopatias;2009-02-13;;2010-10-15
30904013;Cárdio-estimulação transesofágica (CETE), terapêutica ou diagnóstica;2009-02-13;;2010-10-15
30904021;Implante de desfibrilador interno, placas e eletrodos;2009-02-13;;2010-10-15
30904064;Implante de estimulador cardíaco artificial multissítio;2009-02-13;;2010-10-15
30904080;Instalação de marca-passo epimiocárdio temporário;2009-02-13;;2010-10-15
30904099;Implante de marca-passo temporário à beira do leito;2009-02-13;;2010-10-15
30904102;Recolocação de eletrodo / gerador com ou sem troca de unidades;2009-02-13;;2010-10-15
30904110;Retirada do sistema (não aplicável na troca do gerador);2009-02-13;;2010-10-15
30904129;Troca de gerador;2009-02-13;;2010-10-15
30904137;Implante de marca-passo monocameral (gerador + eletrodo atrial ou ventricular);2009-02-13;;2010-10-15
30904145;Implante de marca-passo bicameral (gerador + eletrodo atrial e ventricular);2009-02-13;;2010-10-15
30904153;Remoção de cabo-eletrodo de marcapasso e/ou cárdio-desfibrilador implantável com auxílio de dilatador mecânico, laser ou radiofrequência;2010-09-09;;2010-10-15
30904161;Implante de cardiodesfibrilador multissítio - TRC-D (gerador e eletrodos);2016-01-01;;2016-03-31
30904170;Implante de gerador de eventos (Looper implantável);2016-01-01;2017-04-09;2016-03-31
30904170;Implante de monitor de eventos (Looper implantável);2017-04-10;;2017-07-09
30905010;Colocação de balão intra-aórtico;2009-02-13;;2010-10-15
30905028;Colocação de stent na aorta sem CEC;2009-02-13;;2010-10-15
30905036;Instalação do circuíto de circulação extracorpórea convencional;2009-02-13;;2010-10-15
30905044;Instalação do circuíto de circulação extracorpórea em crianças de baixo peso (10 kg);2009-02-13;;2010-10-15
30905052;Derivação cavo-atrial;2009-02-13;;2010-10-15
30905060;Perfusionista - em procedimentos cardíacos;2009-02-13;;2010-10-15
30906016;Aneurisma de aorta abdominal infra-renal;2009-02-13;;2010-10-15
30906024;Aneurisma de aorta abdominal supra-renal;2009-02-13;;2010-10-15
30906032;Aneurisma de aorta-torácica;2009-02-13;;2010-10-15
30906040;Aneurisma de artérias viscerais;2009-02-13;;2010-10-15
30906059;Aneurisma de axilar, femoral, poplítea;2009-02-13;;2010-10-15
30906067;Aneurisma de carótida, subclávia, ilíaca;2009-02-13;;2010-10-15
30906075;Aneurismas - outros;2009-02-13;;2010-10-15
30906083;Aneurismas torácicos ou tóraco-abdominais;2009-02-13;;2010-10-15
30906113;Angioplastia transluminal transoperatória - por artéria;2009-02-13;;2010-10-15
30906121;Artéria hipogástrica - unilateral - qualquer técnica;2009-02-13;;2010-10-15
30906130;Artéria mesentérica inferior - qualquer técnica;2009-02-13;;2010-10-15
30906148;Artéria mesentérica superior - qualquer técnica;2009-02-13;;2010-10-15
30906156;Artéria renal bilateral revascularização;2009-02-13;;2010-10-15
30906164;Cateterismo da artéria radial - para PAM;2009-02-13;;2010-10-15
30906172;Correção das dissecções da aorta;2009-02-13;;2010-10-15
30906180;Endarterectomia aorto-ilíaca;2009-02-13;;2010-10-15
30906199;Endarterectomia carotídea - cada segmento arterial tratado;2009-02-13;;2010-10-15
30906202;Endarterectomia ilíaco-femoral;2009-02-13;;2010-10-15
30906210;Ligadura de carótida ou ramos;2009-02-13;;2010-10-15
30906229;Ponte aorto-bifemoral;2009-02-13;;2010-10-15
30906237;Ponte aorto-biilíaca;2009-02-13;;2010-10-15
30906245;Ponte aorto-femoral - unilateral;2009-02-13;;2010-10-15
30906253;Ponte aorto-ilíaca - unilateral;2009-02-13;;2010-10-15
30906261;Ponte axilo-bifemoral;2009-02-13;;2010-10-15
30906270;Ponte axilo-femoral;2009-02-13;;2010-10-15
30906288;Ponte distal;2009-02-13;;2010-10-15
30906296;Ponte fêmoro poplítea proximal;2009-02-13;;2010-10-15
30906300;Ponte fêmoro-femoral cruzada;2009-02-13;;2010-10-15
30906318;Ponte fêmoro-femoral ipsilateral;2009-02-13;;2010-10-15
30906326;Ponte subclávio bifemoral;2009-02-13;;2010-10-15
30906334;Ponte subclávio femoral;2009-02-13;;2010-10-15
30906342;Pontes aorto-cervicais ou endarterectomias dos troncos supra-aórticos;2009-02-13;;2010-10-15
30906350;Pontes transcervicais - qualquer tipo;2009-02-13;;2010-10-15
30906377;Preparo de veia autóloga para remendos vasculares;2009-02-13;;2010-10-15
30906385;Arterioplastia da femoral profunda (profundoplastia);2009-02-13;;2010-10-15
30906393;Reoperação de aorta abdominal;2009-02-13;;2010-10-15
30906407;Retirada de enxerto infectado em posição não aórtica;2009-02-13;;2010-10-15
30906415;Revascularização aorto-femoral - unilateral;2009-02-13;;2010-10-15
30906423;Revascularização arterial de membro superior;2009-02-13;;2010-10-15
30906431;Tratamento cirúrgico da isquemia cerebral;2009-02-13;;2010-10-15
30906440;Tratamento cirúrgico de síndrome vértebro basilar;2009-02-13;;2010-10-15
30906458;Tratamento cirúrgico de tumor carotídeo;2009-02-13;;2010-10-15
30906466;Tronco celíaco - qualquer técnica;2009-02-13;;2010-10-15
30907012;Cirurgia de restauração venosa com pontes em cavidades;2009-02-13;;2010-10-15
30907020;Cirurgia de restauração venosa com pontes nos membros;2009-02-13;;2010-10-15
30907039;Cura cirúrgica da impotência coeundi venosa;2009-02-13;;2010-10-15
30907047;Cura cirúrgica de hipertensão portal - qualquer tipo;2009-02-13;;2010-10-15
30907063;Escleroterapia de veias - por sessão;2009-02-13;;2010-10-15
30907071;Fulguração de telangiectasias (por grupo);2009-02-13;;2010-10-15
30907080;Implante de filtro de veia cava;2009-02-13;;2010-10-15
30907098;Interrupção cirúrgica veia cava inferior;2009-02-13;;2010-10-15
30907101;Tratamento cirúrgico de varizes com lipodermatoesclerose ou úlcera (um membro);2009-02-13;;2010-10-15
30907110;Trombectomia venosa;2009-02-13;;2010-10-15
30907128;Valvuloplastia ou interposição de segmento valvulado venoso;2009-02-13;;2010-10-15
30907136;Varizes - tratamento cirúrgico de dois membros;2009-02-13;;2010-10-15
30907144;Varizes - tratamento cirúrgico de um membro;2009-02-13;;2010-10-15
30907152;Varizes - ressecção de colaterais com anestesia local em consultório / ambulatório;2009-02-13;;2010-10-15
30908019;Fístula aorto-cava, reno-cava ou ílio-ilíaca;2009-02-13;;2010-10-15
30908027;Fístula arteriovenosa - com enxerto;2009-02-13;;2010-10-15
30908035;Fístula arteriovenosa cervical ou cefálica extracraniana;2009-02-13;;2010-10-15
30908043;Fístula arteriovenosa congênita - reintervenção;2009-02-13;;2010-10-15
30908051;Fístula arteriovenosa congênita - correção cirúrgica radical;2009-02-13;;2010-10-15
30908060;Fístula arteriovenosa congênita para redução de fluxo;2009-02-13;;2010-10-15
30908078;Fístula arteriovenosa direta;2009-02-13;;2010-10-15
30908086;Fístula arteriovenosa dos grandes vasos intratorácicos;2009-02-13;;2010-10-15
30908094;Fístula arteriovenosa dos membros;2009-02-13;;2010-10-15
30908108;Tromboembolectomia de fístula arteriovenosa;2009-02-13;;2010-10-15
30909023;Hemodiálise contínua (12h);2009-02-13;;2010-10-15
30909031;Hemodiálise crônica (por sessão);2009-02-13;;2010-10-15
30909139;Hemodepuração de casos agudos (sessão hemodiálise, hemofiltração, hemodiafiltração isolada, plasmaferese ou hemoperfusão) - até 4 horas ou fração;2009-02-13;;2010-10-15
30909147;Hemodepuração de casos agudos (sessão hemodiálise, hemofiltração, hemodiafiltração isolada, plasmaferese ou hemoperfusão) - até 12 horas;2009-02-13;;2010-10-15
30909155;Hemodialfiltração online (HDF-OL);2021-04-01;;2021-06-30
30910013;Aneurisma roto ou trombosado de aorta abdominal abaixo da artéria renal;2009-02-13;;2010-10-15
30910021;Aneurismas rotos ou trombosados - outros;2009-02-13;;2010-10-15
30910030;Aneurismas rotos ou trombosados de aorta abdominal acima da artéria renal;2009-02-13;;2010-10-15
30910048;Aneurismas rotos ou trombosados de artérias viscerais;2009-02-13;;2010-10-15
30910056;Aneurismas rotos ou trombosados de axilar, femoral, poplítea;2009-02-13;;2010-10-15
30910064;Aneurismas rotos ou trombosados de carótida, subclávia, ilíaca;2009-02-13;;2010-10-15
30910072;Aneurismas rotos ou trombosados torácicos ou tóraco-abdominais;2009-02-13;;2010-10-15
30910080;Embolectomia ou tromboembolectomia arterial;2009-02-13;;2010-10-15
30910099;Exploração vascular em traumas de outros segmentos;2009-02-13;;2010-10-15
30910102;Exploração vascular em traumas torácicos e abdominais;2009-02-13;;2010-10-15
30910110;Lesões vasculares cervicais e cérvico-torácicas;2009-02-13;;2010-10-15
30910129;Lesões vasculares de membro inferior ou superior - unilateral;2009-02-13;;2010-10-15
30910137;Lesões vasculares intra-abdominais;2009-02-13;;2010-10-15
30910145;Lesões vasculares traumáticas intratorácicas;2009-02-13;;2010-10-15
30911010;Avaliação da viabilidade miocárdica por cateter;2009-02-13;;2010-10-15
30911028;Avaliação fisiológica da gravidade de obstruções (cateter ou guia);2009-02-13;;2010-10-15
30911036;Biópsia endomiocárdica;2009-02-13;;2010-10-15
30911044;Cateterismo cardíaco D e/ou E com  ou  sem  cinecoronariografia / cineangiografia  com  avaliação  de reatividade vascular pulmonar ou teste de sobrecarga hemodinânica;2009-02-13;;2010-10-15
30911052;Cateterismo cardíaco D e/ou E com estudo cineangiográfico e de revascularização cirúrgica do miocárdio;2009-02-13;;2010-10-15
30911060;Cateterismo cardíaco direito com estudo angiográfico da artéria pulmonar;2009-02-13;;2010-10-15
30911079;Cateterismo cardíaco E e/ou D com cineangiocoronariografia e ventriculografia;2009-02-13;;2010-10-15
30911087;Cateterismo cardíaco E e/ou D com cineangiocoronariografia, ventriculografia e estudo angiográfico  da aorta e/ou ramos tóraco-abdominais e/ou membros;2009-02-13;;2010-10-15
30911095;Cateterismo E e estudo cineangiográfico da aorta e/ou seus ramos;2009-02-13;;2010-10-15
30911109;Cateterização cardíaca E por via transeptal;2009-02-13;;2010-10-15
30911117;Estudo eletrofisiológico - mapeamento eletro-eletrônico tridimensional - do sistema de condução com ou sem ação farmacológica;2009-02-13;2017-07-09;2010-10-15
30911125;Estudo hemodinâmico das cardiopatias congênitas  estruturalmente  complexas (menos: CIA, CIV, PCA, Co, AO, estenose aórtica e pulmonar isoladas);2009-02-13;;2010-10-15
30911133;Estudo hemodinâmico de cardiopatias congênitas e/ou valvopatias  com  ou  sem  cinecoronariografia  ou oximetria;2009-02-13;;2010-10-15
30911141;Estudo ultrassonográfico intravascular;2009-02-13;;2010-10-15
30911150;Mapeamento de feixes anômalos e focos ectópicos por eletrofisiologia intracavitária, com provas;2009-02-13;;2010-10-15
30911168;Teste de avaliação do limiar de fibrilação ventricular;2009-02-13;;2010-10-15
30911176;Mapeamento Eletrofisiológico Cardíaco Convencional;2013-12-01;;2014-08-31
30912016;Ablação de circuito arritmogênico por cateter de radiofrequência;2009-02-13;;2010-10-15
30912024;Angioplastia transluminal da aorta ou ramos ou da artéria pulmonar e ramos (por vaso);2009-02-13;;2010-10-15
30912032;Angioplastia transluminal percutânea de múltiplos vasos, com implante de stent;2009-02-13;;2010-10-15
30912040;Angioplastia transluminal percutânea por balão (1 vaso);2009-02-13;;2010-10-15
30912059;Atriosseptostomia por balão;2009-02-13;;2010-10-15
30912067;Atriosseptostomia por lâmina;2009-02-13;;2010-10-15
30912075;Emboloterapia;2009-02-13;;2010-10-15
30912083;Colocação de cateter intracavitário para monitorização hemodinâmica;2009-02-13;;2010-10-15
30912091;Implante de prótese intravascular na aorta/pulmonar ou ramos com ou sem angioplastia;2009-02-13;;2010-10-15
30912105;Implante de stent coronário com ou sem angioplastia por balão concomitante (1 vaso);2009-02-13;;2010-10-15
30912113;Infusão seletiva intravascular de enzimas trombolíticas;2009-02-13;;2010-10-15
30912121;"Oclusão percutânea de ""shunts"" intracardíacos";2009-02-13;;2010-10-15
30912130;Oclusão percutânea de fístula e/ou conexões sistêmico pulmonares;2009-02-13;;2010-10-15
30912148;Oclusão percutânea do canal arterial;2009-02-13;;2010-10-15
30912156;Punção saco pericárdico com introdução de cateter multipolar no espaço pericárdico;2009-02-13;2021-10-31;2010-10-15
30912164;Punção transeptal com introdução de cateter multipolar nas camaras esquerdas e/ou veias pulmonares;2009-02-13;2021-10-31;2010-10-15
30912172;Radiação ou antiproliferação intracoronária;2009-02-13;;2010-10-15
30912180;Recanalização arterial no IAM - angioplastia primária - com implante de stent com ou sem suporte circulatório (balão intra-órtico);2009-02-13;;2010-10-15
30912199;Recanalização mecânica do IAM (angioplastia primária com balão);2009-02-13;;2010-10-15
30912202;Redução miocárdica por infusão seletiva de drogas;2009-02-13;;2010-10-15
30912210;Retirada percutânea de corpos estranhos vasculares;2009-02-13;;2010-10-15
30912229;Revascularização transmiocárdica percutânea;2009-02-13;;2010-10-15
30912237;Tratamento percutâneo do aneurisma/dissecção da aorta;2009-02-13;;2010-10-15
30912245;Valvoplastia percutânea por via arterial ou venosa;2009-02-13;;2010-10-15
30912253;Valvoplastia percutânea por via transeptal;2009-02-13;;2010-10-15
30912261;Angioplastia transluminal percutânea de bifurcação e de tronco com implante de stent;2009-02-13;;2010-10-15
30912270;Ateromectomia rotacional, direcional, extracional ou uso de laser coronariano com ou sem angioplastia por balão, com ou sem implante de stent;2009-02-13;2021-06-30;2010-10-15
30912270;Ateromectomia rotacional, direcional ou extracional, com ou sem angioplastia por balão, com ou sem implante de stent;2021-07-01;2021-07-31;2010-10-15
30912270;Aterectomia rotacional, direcional ou extracional, com ou sem angioplastia por balão, com ou sem implante de stent;2021-08-01;;2010-10-15
30912288;Procedimento terapêutico nas cardiopatias congênitas, exceto atriosseptostomia;2009-02-13;;2010-10-15
30912296;Implante transcateter de prótese valvar aórtica (TAVI);2021-04-01;;2021-06-30
30912300;Oclusão do apêndice atrial esquerdo;2021-08-01;;2021-10-31
30912318;Angioplastia transluminal percutânea por balão para tratamento de oclusão coronária crônica com ou sem stent;2021-08-01;;2021-10-31
30912326;Reparo transcateter valvar mitral ;2021-08-01;;2021-10-31
30912334;Implante transcateter de válvula pulmonar (ITVP);2021-08-01;;2021-10-31
30913012;Implante de cateter venoso central por punção, para NPP, QT, Hemodepuração ou para infusão de soros/drogas;2009-02-13;;2010-10-15
30913020;Instalação de cateter para monitorização hemodinâmica à beira do leito (Swan-Ganz);2009-02-13;;2010-10-15
30913047;Instalação de circuito para assistência mecânica circulatória prolongada (toracotomia);2009-02-13;;2010-10-15
30913055;Manutenção de circuito para assistência mecânica circulatória prolongada - período de 6 horas;2009-02-13;;2010-10-15
30913071;Dissecção de vaso umbilical com colocação de cateter;2009-02-13;;2010-10-15
30913080;Dissecção de veia em RN ou lactente;2009-02-13;;2010-10-15
30913098;Dissecção de veia com colocação cateter venoso;2009-02-13;;2010-10-15
30913101;Implante cirúrgico de cateter de longa permanência para NPP, QT ou para Hemodepuração;2009-02-13;;2010-10-15
30913128;Retirada cirúrgica de cateter de longa permanência para NPP, QT ou para Hemodepuração;2009-02-13;;2010-10-15
30913144;Confecção de fístula AV para hemodiálise;2009-02-13;;2010-10-15
30913152;Retirada/desativação  de fístula AV para hemodiálise;2009-02-13;;2010-10-15
30914019;Anastomose linfovenosa;2009-02-13;;2010-10-15
30914027;Doenca de Hodgkin - estadiamento cirúrgico;2009-02-13;;2010-10-15
30914043;Linfadenectomia inguinal ou ilíaca;2009-02-13;;2010-10-15
30914051;Linfadenectomia cervical;2009-02-13;;2010-10-15
30914060;Linfadenectomia pélvica;2009-02-13;;2010-10-15
30914078;Linfadenectomia retroperitoneal;2009-02-13;;2010-10-15
30914086;Linfangioplastia;2009-02-13;;2010-10-15
30914094;Linfedema - ressecção total;2009-02-13;;2010-10-15
