40402215;Sedimentação de hemácias em Transplante de Células-Tronco Hematopoéticas (TCTH) alogênicos com incompatibilidade ABO maior;2021-08-01;;2021-10-31
40402223;Operação  de  processadora de  sangue  em  fotoaférese  extra  corpórea  (FEC) ;2021-08-01;;2021-10-31
40402231;Material descartável contendo kit para sistema integrado de FEC e solução fotossensibilizante;2021-08-01;;2021-10-31
40403017;Acompanhamento  hospitalar/dia  do  transplante   de  medula   óssea  por médico  hematologista  e/ou hemoterapeuta;2009-02-13;;2010-10-15
40403025;Anticorpos eritrocitários naturais e imunes - titulagem;2009-02-13;;2010-10-15
40403033;Aplicação de medula óssea ou células tronco;2009-02-13;;2010-10-15
40403041;Coleta de células tronco de sangue de cordão umbilical para transplante de medula óssea;2009-02-13;;2010-10-15
40403050;Coleta de células tronco por processadora automática para transplante de medula óssea;2009-02-13;;2010-10-15
40403068;Coleta de biópsia de medula óssea por agulha;2009-02-13;;2010-10-15
40403076;Coleta de medula óssea para transplante;2009-02-13;;2010-10-15
40403084;Determinação de células CD34, CD45 positivas - Citômetro de Fluxo;2009-02-13;;2010-10-15
40403092;Determinação de conteúdo de DNA - Citômetro de Fluxo;2009-02-13;;2010-10-15
40403106;Eletroforese de hemoglobina por componente hemoterápico;2009-02-13;;2010-10-15
40403114;Eletroforese de hemoglobina por unidade de sangue total;2009-02-13;2017-07-09;2010-10-15
40403122;Exsanguíneo  transfusão;2009-02-13;2021-10-31;2010-10-15
40403130;Fenotipagem de outros sistemas eritrocitários - por fenótipo;2009-02-13;;2010-10-15
40403149;Fenotipagem de outros sistemas eritrocitários - por fenótipo - gel teste;2009-02-13;;2010-10-15
40403157;Fenotipagem do sistema RH-HR (D, C, E, C E C) gel teste;2009-02-13;;2010-10-15
40403165;Fenotipagem do sistema RH-HR (D, C, E, C, E);2009-02-13;;2010-10-15
40403173;Grupo sanguíneo ABO e RH - pesquisa;2009-02-13;;2010-10-15
40403181;Grupo sanguíneo ABO e RH - gel teste - pesquisa;2009-02-13;;2010-10-15
40403190;Identificação de anticorpos séricos irregulares antieritrocitários - método de eluição;2009-02-13;;2010-10-15
40403203;Identificação de anticorpos séricos irregulares antieritrocitários - painel de hemácias enzimático;2009-02-13;;2010-10-15
40403211;Identificação de anticorpos séricos irregulares antieritrocitários com painel de hemácias;2009-02-13;;2010-10-15
40403220;Identificação de anticorpos séricos irregulares antieritrocitários com painel de hemácias tratadas por enzimas;2009-02-13;;2010-10-15
40403238;Identificação de anticorpos séricos irregulares antieritrocitários com painel de hemácias - gel liss;2009-02-13;;2010-10-15
40403246;Imunofenotipagem de subpopulações linfocitárias - Citômetro de Fluxo;2009-02-13;;2010-10-15
40403254;Imunofenotipagem para classificação de leucemias - Citômetro de Fluxo;2009-02-13;;2010-10-15
40403262;NAT/HCV por componente hemoterápico - pesquisa e/ou dosagem;2009-02-13;;2010-10-15
40403270;NAT/HCV por unidade de sangue total - pesquisa e/ou dosagem;2009-02-13;2017-07-09;2010-10-15
40403289;NAT/HIV por componente hemoterápico - pesquisa e/ou dosagem;2009-02-13;;2010-10-15
40403297;NAT/HIV por unidade de sangue total - pesquisa e/ou dosagem;2009-02-13;2017-07-09;2010-10-15
40403300;Operação de processadora automática de sangue em aférese;2009-02-13;2021-10-31;2010-10-15
40403319;Operação de processadora automática de sangue em autotransfusão intra-operatória;2009-02-13;2021-10-31;2010-10-15
40403327;Pesquisa de anticorpos séricos antieritrocitários, anti-A e/ou anti-B - gel teste;2009-02-13;;2010-10-15
40403335;Pesquisa de anticorpos séricos antieritrocitários, anti-A e/ou anti-B;2009-02-13;;2010-10-15
40403343;Pesquisa de anticorpos séricos irregulares antieritrocitários;2009-02-13;;2010-10-15
40403351;Pesquisa de anticorpos séricos irregulares antieritrocitários - gel teste;2009-02-13;;2010-10-15
40403360;Pesquisa de anticorpos séricos irregulares antieritrocitários - método de eluição;2009-02-13;;2010-10-15
40403378;Pesquisa de anticorpos séricos irregulares antieritrocitários a frio;2009-02-13;;2010-10-15
40403386;Pesquisa de hemoglobina S por componente hemoterápico - gel teste;2009-02-13;;2010-10-15
40403394;Pesquisa de hemoglobina S por unidade de sangue total - gel teste;2009-02-13;2017-07-09;2010-10-15
40403408;Prova de compatibilidade pré-transfusional completa;2009-02-13;;2010-10-15
40403416;Prova de compatibilidade pré-transfusional completa - gel teste;2009-02-13;;2010-10-15
40403424;S. Anti-HTLV-I + HTLV-II (determinação conjunta) por componente hemoterápico;2009-02-13;;2010-10-15
40403432;S. Anti-HTLV-I + HTLV-II (determinação conjunta) por unidade de sangue total;2009-02-13;2017-07-09;2010-10-15
40403440;S. Chagas EIE por componente hemoterápico - pesquisa e/ou dosagem;2009-02-13;;2010-10-15
40403459;S. Chagas EIE por unidade de sangue total - pesquisa e/ou dosagem;2009-02-13;2017-07-09;2010-10-15
40403467;S. Hepatite B anti-HBC por componente hemoterápico - pesquisa e/ou dosagem;2009-02-13;;2010-10-15
40403475;S. Hepatite B anti-HBC por unidade de sangue total - pesquisa e/ou dosagem;2009-02-13;2017-07-09;2010-10-15
40403483;S. Hepatite C anti-HCV por componente hemoterápico - pesquisa e/ou dosagem;2009-02-13;;2010-10-15
40403491;S. Hepatite C anti-HCV por unidade de sangue total - pesquisa e/ou dosagem;2009-02-13;2017-07-09;2010-10-15
40403505;S. HIV EIE por componente hemoterápico - pesquisa e/ou dosagem;2009-02-13;;2010-10-15
40403513;S. HIV EIE por unidade de sangue total - pesquisa e/ou dosagem;2009-02-13;2017-07-09;2010-10-15
40403521;S. Malária IFI por componente hemoterápico - pesquisa e/ou dosagem;2009-02-13;;2010-10-15
40403530;S. Malária IFI por unidade de sangue total - pesquisa e/ou dosagem;2009-02-13;2017-07-09;2010-10-15
40403548;S. Sífilis EIE por componente hemoterápico - pesquisa e/ou dosagem;2009-02-13;;2010-10-15
40403556;S. Sífilis EIE por unidade de sangue total - pesquisa e/ou dosagem;2009-02-13;2017-07-09;2010-10-15
40403564;S. Sífilis FTA - ABS por componente hemoterápico - pesquisa e/ou dosagem;2009-02-13;;2010-10-15
40403572;S. Sífilis FTA - ABS por unidade de sangue total - pesquisa e/ou dosagem;2009-02-13;2017-07-09;2010-10-15
40403580;S. Sífilis HA por componente hemoterápico - pesquisa e/ou dosagem;2009-02-13;;2010-10-15
40403599;S. Sífilis HA por unidade de sangue total - pesquisa e/ou dosagem;2009-02-13;2017-07-09;2010-10-15
40403602;S. Sífilis VDRL por componente hemoterápico - pesquisa e/ou dosagem;2009-02-13;;2010-10-15
40403610;S. Sífilis VDRL por unidade de sangue total - pesquisa e/ou dosagem;2009-02-13;2017-07-09;2010-10-15
40403629;S. Chagas HA por componente hemoterápico - pesquisa e/ou dosagem;2009-02-13;;2010-10-15
40403637;S. Chagas HA por unidade de sangue total - pesquisa e/ou dosagem;2009-02-13;2017-07-09;2010-10-15
40403645;S. Chagas IFI por componente hemoterápico - pesquisa e/ou dosagem;2009-02-13;;2010-10-15
40403653;S. Chagas IFI por unidade de sangue total - pesquisa e/ou dosagem;2009-02-13;2017-07-09;2010-10-15
40403661;S. Hepatite B (HBsAg) RIE ou EIE por componente hemoterápico - pesquisa e/ou dosagem;2009-02-13;;2010-10-15
40403670;S. Hepatite B (HBsAg) RIE ou EIE por unidade de sangue total - pesquisa e/ou dosagem;2009-02-13;2017-07-09;2010-10-15
40403688;Teste de Coombs direto;2009-02-13;;2010-10-15
40403696;Teste de Coombs direto - gel teste;2009-02-13;;2010-10-15
40403700;Teste de Coombs direto - mono específico (IgG, IgA, C3, C3D, Poliv. - AGH) - gel teste;2009-02-13;;2010-10-15
40403718;Teste de Coombs indireto - mono específico (IgG, IgA, C3, C3D, Poliv. - AGH) - gel teste;2009-02-13;;2010-10-15
40403726;TMO - congelamento de medula óssea ou células tronco periféricas;2009-02-13;;2010-10-15
40403734;TMO - cultura de linfócitos doador e receptor;2009-02-13;;2010-10-15
40403742;TMO - descongelamento de medula óssea ou células tronco;2009-02-13;;2010-10-15
40403750;TMO - determinação de HLA   transplantes de medula óssea - loci DR e DQ (alta resolução);2009-02-13;;2010-10-15
40403769;TMO - determinação de HLA para transplantes de medula óssea - loci A e B;2009-02-13;;2010-10-15
40403777;TMO - determinação de HLA para transplantes de medula óssea - loci DR e DQ (baixa resolução);2009-02-13;;2010-10-15
40403785;TMO - determinação de unidades formadoras de colônias;2009-02-13;;2010-10-15
40403793;TMO - determinação de viabilidade de medula óssea;2009-02-13;;2010-10-15
40403807;TMO - manutenção de congelamento de medula óssea ou células tronco (até 2 anos);2009-02-13;;2010-10-15
40403815;TMO - preparo de medula óssea ou células tronco periféricas para congelamento;2009-02-13;;2010-10-15
40403823;TMO - preparo e filtração de medula óssea ou células tronco na coleta;2009-02-13;;2010-10-15
40403831;"TMO - tratamento ""in vitro"" de medula óssea ou células tronco por anticorpos monoclonais (purging)(4)";2009-02-13;;2010-10-15
40403840;Transaminase pirúvica - TGP ou ALT por componente hemoterápico - pesquisa e/ou dosagem;2009-02-13;;2010-10-15
40403858;Transaminase pirúvica - TGP ou ALT por unidade de sangue total - pesquisa e/ou dosagem;2009-02-13;2017-07-09;2010-10-15
40403866;Transfusão fetal intra-uterina;2009-02-13;2021-10-31;2010-10-15
40403874;Detecção de consumo de oxigênio  (O2) por unidade de concentrado de plaquetas (por unidade de concentrado de plaquetas de doador múltiplo);2009-02-13;2021-09-30;2010-10-15
40403882;Detecção de consumo de oxigênio (O2) por unidade de concentrado de plaquetas (por unidade de concentrado de plaquetas por aférese);2009-02-13;2021-09-30;2010-10-15
40403890;NAT/HBV - por componente hemoterápico - pesquisa e/ou dosagem;2009-02-13;;2010-10-15
40403904;NAT/HBV - por unidade de sangue total - pesquisa e/ou dosagem;2009-02-13;2017-07-09;2010-10-15
40403912;Estimulação e mobilização de células CD34 positivas;2009-02-13;;2010-10-15
40403920;Determinação do fator RH (D), incluindo prova para D-fraco no sangue do receptor;2009-02-13;;2010-10-15
40403939;Doação autóloga com recuperação intra-operatória;2009-02-13;;2010-10-15
40403947;Doação autóloga peri-operatória por hemodiluição normovolêmica;2009-02-13;;2010-10-15
40403955;Doação autóloga pré-operatória;2009-02-13;;2010-10-15
40403963;Exames imunohematológicos em recém-nascidos: tipificação ABO e RH, pesquisa de D fraco RH(D) e prova da antiglobulina direta;2009-02-13;;2010-10-15
40403971;Imuno-hematológicos: tipificação ABO, incluindo tipagem reversa e determinação do fator RH (D), incluindo prova para D-fraco e pesquisa e identificação de anticorpos séricos irregulares antieritrocitários;2009-02-13;;2010-10-15
40403980;Investigação da presença de anti-A ou anti-B, em soro ou plasma de neonato, com métodos que incluam uma fase antiglobulínica;2009-02-13;;2010-10-15
40403998;Tipificação ABO, incluindo tipagem reversa no sangue do receptor (sem tipagem reversa até 4 meses de idade);2009-02-13;;2010-10-15
40404013;TMO - prova cruzada para histocompatibilidade de transplante de medula óssea;2009-02-13;;2010-10-15
40404021;Aférese para paciente ABO incompatível;2010-09-09;2021-10-31;2010-10-15
40404030;Antigenemia para diagnóstico de CMV pós transplante;2010-09-09;;2010-10-15
40404048;Avaliação quimerismo - VNTR - doador - pré transplante;2010-09-09;;2010-10-15
40404056;Avaliação quimerismo - VNTR - paciente - pré transplante;2010-09-09;;2010-10-15
40404064;Avaliação quimerismo por STR - paciente - pós transplante;2010-09-09;;2010-10-15
40404072;Coleta de linfócitos de sangue periférico por aférese para tratamento de recidivas pós TCTH alogênico;2010-09-09;;2010-10-15
40404080;Controle microbiológico da medula óssea no TCTH alogênico;2010-09-09;;2010-10-15
40404099;Controle microbiológico das células tronco periféricas no TCTH alogênico;2010-09-09;;2010-10-15
40404102;Depleção de plasma em TCTH alogênicos com incompatibilidade ABO menor;2010-09-09;2021-10-31;2010-10-15
40404110;PCR em tempo real para diagnóstico de adenovírus;2010-09-09;;2010-10-15
40404129;PCR em tempo real para diagnóstico de EBV - pós transplante;2010-09-09;;2010-10-15
40404137;PCR em tempo real para diagnóstico de Herpes virus 6 - pos transplante;2010-09-09;;2010-10-15
40404145;PCR em tempo real para diagnóstico de Herpes virus 8 - pos transplante;2010-09-09;;2010-10-15
40404153;PCR em tempo real para os vírus para influenza e influenza;2010-09-09;2020-05-31;2010-10-15
40404153;PCR em tempo real para os vírus parainfluenza e influenza;2020-06-01;;2010-10-15
40404161;PCR em tempo real para vírus respiratório sincicial;2010-09-09;;2010-10-15
40404170;Quantificação de CD14 da coleta de células tronco periféricas para TCTH alogênico;2010-09-09;;2010-10-15
40404188;Quantificação de CD19 da coleta de células tronco periféricas para TCTH alogênico;2010-09-09;;2010-10-15
40404196;Quantificação de CD3  da coleta de células tronco periféricas para TCTH alogênico;2010-09-09;;2010-10-15
40404200;Quantificação de CD3  da coleta de linfócitos para tratamento de recidivas pós TCTH alogênico;2010-09-09;;2010-10-15
40404218;Quantificação de CD4 da coleta de células tronco periféricas para TCTH alogênico;2010-09-09;;2010-10-15
40404226;Quantificação de CD8 da coleta de células tronco periféricas para TCTH alogênico;2010-09-09;;2010-10-15
40404234;Quantificação de leucócitos totais da coleta de células tronco periféricas para TCTH alogênico;2010-09-09;;2010-10-15
40404242;Quantificação de leucócitos totais da Medula Óssea no TCTH alogênico;2010-09-09;;2010-10-15
40404250;Sedimentação de hemácias em TCTH alogênicos com incompatibilidade ABO maior;2010-09-09;2021-10-31;2010-10-15
40404269;Viabilidade celular dos linfócitos periféricos por citometria de fluxo para tratamento das recidivas pós TCTH alogênico;2010-09-09;;2010-10-15
40404277;Viabilidade celular da medula óssea por citometria de fluxo após o descongelamento;2010-09-09;;2010-10-15
40404285;Viabilidade celular das células tronco periféricas por citometria de fluxo após o descongelamento;2010-09-09;;2010-10-15
40404293;Genotipagem Duffy_Gata;2012-10-10;;2014-08-31
40404307;Genotipagem Kell;2012-10-10;;2014-08-31
40404315;Genotipagem Kidd;2012-10-10;;2014-08-31
40404323;Genotipagem para zigosidade D;2012-10-10;;2014-08-31
40404331;Genotipagem RhD parcial;2012-10-10;;2014-08-31
40404340;Imunofluorescência direta de pele;2012-10-10;;2014-08-31
40404358;Descalcificação de tecido, anatomia patológica;2012-10-10;;2014-08-31
40404366;NAT teste de ácido nucleico HIV/HCV/HBV;2012-10-10;;2014-08-31
40404374;S. Anticorpo anti-CMV (IgG), por unidade de sangue total;2012-10-10;;2014-08-31
40404382;S. Anticorpo anti-CMV (IgM), por unidade de sangue total;2012-10-10;;2014-08-31
40404390;Concentrado de hemácias raras congeladas;2012-10-10;;2014-08-31
40404404;Fenotipagem do sistema RH-HR (D, C, E, C, E) e Kell;2012-10-10;;2014-08-31
40404412;Fotoférese;2012-10-10;;2014-08-31
40404420;Genotipagem completa plaquetária (HPA 1, 6 e 15);2012-10-10;;2014-08-31
40404439;Genotipagem HPA por sistema;2012-10-10;;2014-08-31
40404447;Genotipagem RHD, Cc, Ec, Pse, K, Kid, Df, Gata;2012-10-10;;2014-08-31
40404455;Genotipagem RHD, Cc, Ee, Pseudogene;2012-10-10;;2014-08-31
40404463;Genotipagem RHD, Cc, Ee, Pseudogene, Kell;2012-10-10;;2014-08-31
40404471;Genotipagem Ss;2012-10-10;;2014-08-31
40404480;Granulócitos CMV negativos;2012-10-10;;2014-08-31
40404498;Pesquisa de hemolisina;2012-10-10;;2014-08-31
40404501;Pesquisa e identificação de anticorpos plaquetários (MAIPA);2012-10-10;;2014-08-31
40404510;Plaquetaférese CMV negativos;2012-10-10;;2014-08-31
40404528;Plaquetaférese HLA compatível;2012-10-10;;2014-08-31
40404536;Prova de compatibilidade para transfusão de plaquetas (MAIPA);2012-10-10;;2014-08-31
40404544;Técnicas de adsorção;2012-10-10;;2014-08-31
40404552;Controle bacteriológico para concentrado de plaquetas;2021-08-01;;2021-10-31
40404560;Pesquisa de anticorpos séricos irregulares antieritrocitários - método de eluição - gel teste;2021-08-01;;2021-10-31
40404579;Identificação de anticorpos anti-eritrocitários a frio em gel;2021-08-01;;2021-10-31
40501019;Cariótipo com bandas de pele, tumor e demais tecidos;2009-02-13;;2010-10-15
40501027;Cariótipo com pesquisa de troca de cromátides irmãs;2009-02-13;;2010-10-15
40501035;Cariótipo com técnicas de alta resolução;2009-02-13;;2010-10-15
40501043;Cariótipo de medula (técnicas com bandas);2009-02-13;;2010-10-15
40501051;Cariótipo de sangue (técnicas com bandas);2009-02-13;;2010-10-15
40501060;Cariótipo de sangue obtido por cordocentese pré-natal;2009-02-13;;2010-10-15
40501078;Cariótipo de sangue-pesquisa de marcadores tumorais;2009-02-13;;2010-10-15
40501086;Cariótipo de sangue-pesquisa de sítio frágil X;2009-02-13;;2010-10-15
40501094;Cariótipo em vilosidades coriônicas (cultivo de trofoblastos);2009-02-13;;2010-10-15
40501108;Cariótipo para pesquisa de instabilidade cromossômica;2009-02-13;;2010-10-15
40501116;Cromatina X ou Y;2009-02-13;;2010-10-15
40501124;Cultura de material de aborto e obtenção de cariótipo;2009-02-13;;2010-10-15
40501132;Cultura de tecido para ensaio enzimático e/ou extração de DNA;2009-02-13;;2010-10-15
40501140;Diagnóstico genético pré-implantação por fish, por sonda;2009-02-13;;2010-10-15
40501159;Fish em metáfase ou núcleo interfásico, por sonda;2009-02-13;;2010-10-15
40501167;Fish pré-natal, por sonda;2009-02-13;;2010-10-15
40501175;Líquido amniótico, cariótipo com bandas;2009-02-13;;2010-10-15
40501183;Líquido amniótico, vilosidades coriônicas, subcultura para dosagens bioquímicas e/ou moleculares (adicional);2009-02-13;;2010-10-15
40501191;Subcultura de pele para dosagens bioquímicas e/ou moleculares (adicional);2009-02-13;;2010-10-15
40501205;Estudo de alterações cromossômicas em leucemias por FISH (Fluorescence In Situ Hybridization);2010-09-09;;2010-10-15
40501213;Pesquisa de translocação PML/RAR-a;2010-09-09;;2010-10-15
40501221;Cariótipo de sangue (técnicas com bandas) - Análise de 50 células para detecção de mosaicismo;2012-10-10;;2014-08-31
40501230;Cultura de fibroblastos (pele);2012-10-10;;2014-08-31
40501248;CITOGENÉTICA DE MEDULA ÓSSEA;2012-10-10;2013-07-31;2013-11-30
40501248;HER2 FISH para amplificação gênica em tumor de mama;2016-01-01;;2016-03-31
40501256;HER2 CISH para amplificação gênica em tumor de mama;2016-01-01;;2016-03-31
40501264;"Translocação PML/RARA  t(15;17) FISH em medula óssea";2016-01-01;;2016-03-31
40501272;"Translocação PML/RARA  t(15;17) FISH em sangue periférico";2016-01-01;;2016-03-31
40501280;Hibridização in situ pela prata ou cromogênica  (CISH) - Histoquímica;2016-01-01;;2016-03-31
40502015;Marcadores bioquímicos extras, além de BHCG, AFP e PAPP-A, para avaliação do risco fetal, por marcador, por amostra;2009-02-13;;2010-10-15
40502040;Baterias de testes químicos de triagem em urina para erros inatos do metabolismo (mínimo de seis testes);2009-02-13;;2010-10-15
40502058;Determinação do risco fetal, com elaboração de laudo;2009-02-13;;2010-10-15
40502066;Dosagem quantitativa de ácidos orgânicos, carnitina, perfil de acilcarnitina, ácidos graxos de cadeia muito longa, para o diagnóstico de erros inatos do metabolismo (perfil em uma amostra);2009-02-13;;2010-10-15
40502074;Dosagem quantitativa de aminoácidos para o diagnóstico de erros inatos do metabolismo (perfil de aminoácidos numa amostra);2009-02-13;;2010-10-15
40502082;Dosagem quantitativa de metabólitos na urina e/ou sangue para o diagnóstico de erros inatos do metabolismo (cada);2009-02-13;;2010-10-15
40502090;Eletroforese ou cromatografia (papel ou camada delgada) para identificação de aminoácidos ou glicídios ou oligossacarídios ou sialoligossacarídios glicosaminoglicanos ou outros compostos para detecção de erros inatos do metabolismo (cada);2009-02-13;;2010-10-15
40502104;Ensaios enzimáticos em células cultivadas para diagnóstico de EIM, incluindo preparo do material, dosagem de proteína e enzima de referência (cada);2009-02-13;;2010-10-15
40502112;Ensaios enzimáticos em leucócitos, eritrócitos ou tecidos para diagnóstico de EIM, incluindo preparo do material, dosagem de proteína e enzima de referência (cada);2009-02-13;;2010-10-15
40502120;Ensaios enzimáticos no plasma para diagnóstico de EIM, incluindo enzima de referência (cada);2009-02-13;;2010-10-15
40502139;Teste duplo - 1 trimestre (PAPP-A+Beta-HCG) ou outros 2 em soro ou líquido aminiótico com elaboração de laudo contendo cálculo de risco para anomalias fetais;2009-02-13;;2010-10-15
40502147;Teste duplo - 2 trimestre (AFP+Beta-HCG) ou outros 2 em soro ou líquido aminiótico com elaboração de laudo contendo cálculo de risco para anomalias fetais;2009-02-13;;2010-10-15
40502155;Teste triplo (AFP+Beta-HCG+Estriol) ou outros 3 em soro ou líquido aminiótico com elaboração de laudo contendo cálculo de risco para anomalias fetais;2009-02-13;;2010-10-15
40502163;Testes químicos de triagem em urina para erros inatos do metabolismo (cada);2009-02-13;;2010-10-15
40502171;Dosagem quantitativa de carnitina e perfil de acilcarnitina, para o diagnóstico de erros inatos do metabolismo;2012-10-10;;2014-08-31
40502180;Dosagem quantitativa de ácidos graxos de cadeia muito longa  para o diagnóstico de EIM;2012-10-10;;2014-08-31
40502198;Dosagem quantitativa de metabólitos por cromatografia / espectrometria de massa  (CG/MS ou HPLC/MS ) para o diagnóstico de EIM;2012-10-10;;2014-08-31
40502201;Dosagem quantitativa de metabólitos por espectrometria de massa ou espectrometria de massa em TANDEM (MS OU MS/MS) para o diagnóstico de EIM;2012-10-10;;2014-08-31
40502210;Terapia de reposição enzimática por infusão endovenosa, por procedimento;2012-10-10;;2014-08-31
40502228;Rastreamento neonatal para o diagnósitco de EIM e outras doenças;2012-10-10;;2014-08-31
40502236;Dosagem quantitativa de ácidos orgânicos para o diagnóstico de erros inatos do metabolismo (perfil de ácidos orgânicos numa amostra);2012-10-10;;2014-08-31
40502244;Defeitos congênitos da glicolização - Focalização isoelétrica da transferrina;2016-01-01;;2016-03-31
40503011;Análise de DNA com enzimas de restrição por enzima utilizada, por amostra;2009-02-13;;2010-10-15
40503020;Análise de DNA fetal por enzima de restrição, por enzima utilizada, por amostra (adicional nos exames em que já foi feito o PCR 4.05.03.06-2 e depende da enzima para estabelecer o diagnóstico);2009-02-13;;2010-10-15
40503038;Análise de DNA fetal por sonda ou PCR por locus, por amostra;2009-02-13;;2010-10-15
40503046;Análise de DNA pela técnica multiplex por locus extra, por amostra;2009-02-13;;2010-10-15
40503054;Análise de DNA pela técnica multiplex por locus, por amostra;2009-02-13;;2010-10-15
40503062;Análise de DNA por sonda, ou PCR por locus, por amostra;2009-02-13;;2010-10-15
40503070;Diagnóstico genético pré-implantação por DNA, por sonda de FISH ou por primer de PCR, por amostra;2009-02-13;;2010-10-15
40503089;Extração de DNA (osso), por amostra;2009-02-13;;2010-10-15
40503097;Extração de DNA (sangue, urina, líquido aminiótico, vilo trofoblástico etc.), por amostra;2009-02-13;;2010-10-15
40503100;Identificação de mutação por sequenciamento do DNA, por 100 pares de base sequenciadas, por amostra;2009-02-13;;2010-10-15
40503119;Processamento de qualquer tipo de amostra biológica para estabilização do ácido nucléico, por amostra;2012-10-10;;2014-08-31
40503127;Extração, purificação e quantificação de ácido nucléico de qualquer tipo de amostra biológica, por amostra;2012-10-10;;2014-08-31
40503135;Transcrição reversa de RNA, por amostra;2012-10-10;;2014-08-31
40503143;Amplificação do material genético (por PCR, PCR em tempo Real, LCR, RT-PCR ou outras técnicas), por primer utilizado, por amostra;2012-10-10;;2014-08-31
40503151;Análise de DNA por MLPA, por sonda de DNA utilizada, por amostra;2012-10-10;;2014-08-31
40503160;Análise de DNA pela técnica de Southern Blot, por sonda utilizada, por amostra;2012-10-10;;2014-08-31
40503178;Produção de DOT/SLOT-BLOT, por BLOT, por amostra;2012-10-10;;2014-08-31
40503186;Separação do material genético por eletroforese capilar ou em gel (agarose, acrilamida), por gel utilizado, por amostra;2012-10-10;;2014-08-31
40503194;Rastreamento de exon mutado (por gradiente de desnaturação ou conformação de polimorfismo de fita simples ou RNAse ou Clivagem Química ou outras técnicas) para identificação de fragmento mutado, por fragmento analisado, por amostra;2012-10-10;;2014-08-31
40503208;Coloração de gel e Fotodocumentação da análise molecular, por amostra;2012-10-10;;2014-08-31
40503216;Interpretação e elaboração do laudo da análise genética, por amostra;2012-10-10;;2014-08-31
40503224;Análise de expressão gênica por locus, por amostra, por CGH array, SNP array ou outras técnicas;2012-10-10;;2014-08-31
40503232;Detecção pré-natal ou pós-natal de alterações cromossômicas submicroscópicas reconhecidamente causadoras de síndrome de genes contíguos, por FISH, qPCR ou outra técnica, por locus, por amostra;2012-10-10;;2014-08-31
40503240;Rastreamento pré-natal ou pós-natal de todo o genoma para  identificar alterações cromossômicas submicroscópicas por CGH-array ou SNP-array ou outras técnicas, por clone ou oligo utilizado, por amostra;2012-10-10;;2014-08-31
